{
  "$schema": "https://json-schema.org/draft/2020-12/schema",
  "$id": "https://polyglot-import-csv.local/schemas/import_config.schema.json",
  "title": "PolyglotImportCSV import configuration",
  "description": "Declarative mapping from named CSV sources to entities and relationships of one or more DBMSs. Connection settings live in the separate DBMS configuration.",
  "type": "object",
  "required": ["sources"],
  "properties": {
    "sources": {
      "type": "object",
      "minProperties": 1,
      "description": "Named data sources: a CSV path per entity, or a combined CSV whose column 0 holds each row's origin.",
      "additionalProperties": {
        "oneOf": [
          { "type": "string", "minLength": 1 },
          {
            "type": "object",
            "required": ["file", "origin_column"],
            "properties": {
              "file": { "type": "string", "minLength": 1 },
              "origin_column": { "const": true }
            },
            "additionalProperties": false
          }
        ]
      }
    },
    "postgres": { "$ref": "#/$defs/postgresMapping" },
    "mongodb": { "$ref": "#/$defs/mongoMapping" },
    "cassandra": { "$ref": "#/$defs/cassandraMapping" },
    "redis": { "$ref": "#/$defs/redisMapping" },
    "neo4j": { "$ref": "#/$defs/neo4jMapping" }
  },
  "additionalProperties": false,
  "$defs": {
    "columnSpec": {
      "type": "object",
      "description": "Leaf mapping from a CSV column to a destination field.",
      "properties": {
        "is_key": {
          "type": "boolean",
          "description": "Primary or merge key for the entity."
        },
        "csv_column": {
          "description": "CSV header name or 1-based data-column index when it differs from the JSON key.",
          "oneOf": [
            { "type": "string", "minLength": 1 },
            { "type": "integer", "minimum": 1 }
          ]
        },
        "schema_column": {
          "type": "string",
          "minLength": 1,
          "description": "Destination field name when it differs from the JSON key."
        },
        "db_type": {
          "type": "string",
          "description": "SQL/CQL type for DDL generation (PostgreSQL, Cassandra)."
        }
      },
      "additionalProperties": false
    },
    "columnEntry": {
      "description": "Either a leaf columnSpec or a nested object (MongoDB subdocuments).",
      "oneOf": [
        { "$ref": "#/$defs/columnSpec" },
        {
          "type": "object",
          "minProperties": 1,
          "additionalProperties": { "$ref": "#/$defs/columnEntry" }
        }
      ]
    },
    "filter": {
      "type": "object",
      "description": "Row predicate applied to the rows of the CSV before they are written.",
      "required": ["column", "operator"],
      "properties": {
        "column": { "type": "string", "minLength": 1 },
        "operator": {
          "type": "string",
          "enum": ["==", "!=", ">", "<", ">=", "<=", "in", "not_in", "each"]
        },
        "value": {},
        "target_suffix": {
          "type": "string",
          "description": "With operator 'each', optional template; default is sanitized distinct value"
        }
      },
      "additionalProperties": false
    },
    "entity": {
      "type": "object",
      "description": "One logical target (table, collection, label, or Redis entity).",
      "properties": {
        "columns": {
          "type": "object",
          "minProperties": 1,
          "additionalProperties": { "$ref": "#/$defs/columnEntry" }
        },
        "filters": {
          "type": "array",
          "items": { "$ref": "#/$defs/filter" }
        },
        "cassandra_partition": {
          "type": "array",
          "items": { "type": "string" },
          "description": "CSV/source column names forming the partition key (compound supported)"
        },
        "cassandra_cluster": {
          "type": "array",
          "items": { "type": "string" },
          "description": "Clustering columns (optional)"
        },
        "source": {
          "description": "Source name, or list of source names (union with _source per row). Omit to bind by the entity key name.",
          "oneOf": [
            { "type": "string", "minLength": 1 },
            { "type": "array", "minItems": 1, "items": { "type": "string", "minLength": 1 } }
          ]
        },
        "csv_columns": {
          "type": "array",
          "minItems": 1,
          "description": "Auto-map restriction: column names, 1-based indices, or ranges like \"1-5\". Only valid with auto-mapping.",
          "items": {
            "oneOf": [
              { "type": "string", "minLength": 1 },
              { "type": "integer", "minimum": 1 }
            ]
          }
        },
        "auto_map": {
          "type": "boolean",
          "description": "With 'columns' present, auto-map the whole source and let the manual entries override per column."
        }
      },
      "additionalProperties": false
    },
    "postgresMapping": {
      "type": "object",
      "required": ["entities"],
      "properties": {
        "entities": {
          "type": "object",
          "additionalProperties": { "$ref": "#/$defs/entity" }
        },
        "relationships": {
          "type": "object",
          "additionalProperties": {
            "type": "object",
            "required": ["from", "to", "foreign_key"],
            "properties": {
              "from": { "type": "string" },
              "to": { "type": "string" },
              "foreign_key": { "type": "string" },
              "references_key": { "type": "string" }
            },
            "additionalProperties": false
          }
        }
      },
      "additionalProperties": false
    },
    "mongoMapping": {
      "type": "object",
      "required": ["entities"],
      "properties": {
        "entities": {
          "type": "object",
          "additionalProperties": { "$ref": "#/$defs/entity" }
        }
      },
      "additionalProperties": false
    },
    "cassandraMapping": {
      "type": "object",
      "required": ["entities"],
      "properties": {
        "entities": {
          "type": "object",
          "additionalProperties": { "$ref": "#/$defs/entity" }
        }
      },
      "additionalProperties": false
    },
    "redisMapping": {
      "type": "object",
      "required": ["entities"],
      "properties": {
        "entities": {
          "type": "object",
          "additionalProperties": { "$ref": "#/$defs/entity" }
        }
      },
      "additionalProperties": false
    },
    "neo4jMapping": {
      "type": "object",
      "required": ["entities"],
      "properties": {
        "entities": {
          "type": "object",
          "additionalProperties": { "$ref": "#/$defs/entity" }
        },
        "relationships": {
          "type": "object",
          "additionalProperties": {
            "type": "object",
            "required": ["from", "to", "type"],
            "properties": {
              "from": { "type": "string" },
              "to": { "type": "string" },
              "type": { "type": "string" },
              "columns": {
                "type": "object",
                "additionalProperties": { "$ref": "#/$defs/columnSpec" }
              }
            },
            "additionalProperties": false
          }
        }
      },
      "additionalProperties": false
    }
  }
}
